{
  "$schema": "https://json-schema.org/draft/2020-12/schema",
  "$id": "https://subtube.hafa.cc/schema/device-file.schema.json",
  "title": "subtube device file, version 1",
  "description": "One device's channel filters, watched marks and settings, kept as device-<deviceId>.json in the user's Google Drive app folder (<deviceId> matches ^[A-Za-z0-9_-]+$). Each device writes only its own file and reads every device's file. This schema says what a writer must write. Readers are more forgiving (shared/fixtures/merge.json) and must keep fields they don't know: an object read from a file and written back, or a filter edited and saved, keeps every unknown field unchanged, so a newer client's additions survive an older client's saves. Adding an optional field keeps version 1; any change an older reader would misread bumps `version`, and a reader skips files whose version it doesn't know.",
  "type": "object",
  "required": [
    "version",
    "channels",
    "watched"
  ],
  "properties": {
    "version": {
      "description": "Format version. Readers skip a file whose version they don't know.",
      "const": 1
    },
    "channels": {
      "description": "The last filter this device saved for each channel, keyed by YouTube channel id (UC…).",
      "type": "object",
      "propertyNames": {
        "minLength": 1
      },
      "additionalProperties": {
        "$ref": "#/$defs/channelEntry"
      }
    },
    "watched": {
      "description": "The last watched mark this device made for each video or playlist, keyed by its YouTube id, with how far a video, or a playlist's video, has been played. An entry is dropped when the device writes once both its `at` and its `seen` are 30 days old or more (shared/fixtures/prune.json).",
      "type": "object",
      "propertyNames": {
        "minLength": 1
      },
      "additionalProperties": {
        "$ref": "#/$defs/watchedEntry"
      }
    },
    "settings": {
      "description": "The last value this device saved for each synced setting, keyed by setting name. Optional: a file without it has saved no setting. Names and values this schema doesn't list are allowed and kept; shared/fixtures/settings.json says how the known ones are read: feedSort (newest, oldest, shortest, longest, title, titleReversed, random), channelSort (newest, name, unwatched), autoplay (boolean), timeChip (none, day, week, month), topicChips (array of YouTube video category ids, as strings), channelTimeChip (as timeChip), channelTopicChips (as topicChips), groupChips and channelGroupChips (arrays of group names, shared/fixtures/groups.json).",
      "type": "object",
      "propertyNames": {
        "minLength": 1
      },
      "additionalProperties": {
        "$ref": "#/$defs/settingEntry"
      }
    }
  },
  "$defs": {
    "channelEntry": {
      "type": "object",
      "required": [
        "at",
        "filter"
      ],
      "properties": {
        "at": {
          "description": "When the entry was saved, in milliseconds since the Unix epoch (UTC).",
          "type": "integer",
          "minimum": 0,
          "maximum": 9007199254740991
        },
        "filter": {
          "$ref": "#/$defs/filter"
        }
      }
    },
    "watchedEntry": {
      "type": "object",
      "required": [
        "at",
        "watched"
      ],
      "properties": {
        "at": {
          "description": "When the entry was saved, in milliseconds since the Unix epoch (UTC).",
          "type": "integer",
          "minimum": 0,
          "maximum": 9007199254740991
        },
        "watched": {
          "description": "true: the item is watched whatever else the entry holds — a mark made without playing (setup's starting point), a playlist whose last video ended, or a video whose player reported the end. false: an explicit unmark, or a video or playlist being played; a video is then watched or not by its `position` (shared/fixtures/watch-progress.json).",
          "type": "boolean"
        },
        "position": {
          "description": "How far the video has been played, in seconds from its start; may be fractional. In a playlist's entry it is how far into `video`. Optional: an entry without it has no position. For a video, a reader works out from it and the video's length whether the video is watched, where it resumes and how full its progress bar is (shared/fixtures/watch-progress.json).",
          "type": "number",
          "minimum": 0
        },
        "video": {
          "description": "In a playlist's entry, the YouTube id of the video of the playlist that was playing, which `position` is into; the playlist starts there when opened (shared/fixtures/watch-progress.json). Optional: an entry without it starts at the playlist's first video, and a video's entry never has one.",
          "type": "string",
          "minLength": 1
        },
        "progress": {
          "description": "In a playlist's entry, how far through the playlist `video` and `position` are, from 0 to 1, counting every video as equally long; it fills the playlist's progress bar (shared/fixtures/watch-progress.json). Optional: an entry without it has no bar until the playlist is watched, and a video's entry never has one.",
          "type": "number",
          "minimum": 0,
          "maximum": 1
        },
        "seen": {
          "description": "When this device last had the item among the items of a full load, in milliseconds since the Unix epoch (UTC). Optional: an entry without it has not been in a load since it was saved. Set after a load, at most once a day per entry, without changing `at`; it takes no part in merging, where `at` alone orders entries (shared/fixtures/merge.json). It keeps the entry from being dropped (shared/fixtures/prune.json).",
          "type": "integer",
          "minimum": 0,
          "maximum": 9007199254740991
        }
      }
    },
    "settingEntry": {
      "type": "object",
      "required": [
        "at",
        "value"
      ],
      "properties": {
        "at": {
          "description": "When the entry was saved, in milliseconds since the Unix epoch (UTC).",
          "type": "integer",
          "minimum": 0,
          "maximum": 9007199254740991
        },
        "value": {
          "description": "The setting's value: any JSON value. A reader that doesn't recognize it uses the setting's default and still keeps the entry."
        }
      }
    },
    "filter": {
      "description": "A channel's filter (shared/fixtures/filters.json). The channel's identity (id, title, thumbnail) belongs to YouTube and is never stored here. A reader treats a missing field, or one holding a value it doesn't recognize, as the field's default.",
      "type": "object",
      "required": [
        "enabled",
        "regex",
        "mode"
      ],
      "properties": {
        "enabled": {
          "description": "Whether the main feed loads this channel. Default true.",
          "type": "boolean"
        },
        "regex": {
          "description": "Filter pattern in the shared pattern language (shared/patterns/README.md); \"\" means no pattern. Default \"\". The pattern below is shared/patterns/meta-regex.txt.",
          "type": "string",
          "pattern": "^(?:(?:\\^|\\$|\\\\[bB]|(?:[^\\\\\\^\\$\\.\\|\\?\\*\\+\\(\\)\\[\\]\\{\\}]|\\\\[\\\\\\^\\$\\.\\|\\?\\*\\+\\(\\)\\[\\]\\{\\}\\/tnrdDwWsS]|\\.|\\[\\^?(?!:)(?:0-[0-9]|1-[1-9]|2-[2-9]|3-[3-9]|4-[4-9]|5-[5-9]|6-[6-9]|7-[7-9]|8-[8-9]|9-[9-9]|a-[a-z]|b-[b-z]|c-[c-z]|d-[d-z]|e-[e-z]|f-[f-z]|g-[g-z]|h-[h-z]|i-[i-z]|j-[j-z]|k-[k-z]|l-[l-z]|m-[m-z]|n-[n-z]|o-[o-z]|p-[p-z]|q-[q-z]|r-[r-z]|s-[s-z]|t-[t-z]|u-[u-z]|v-[v-z]|w-[w-z]|x-[x-z]|y-[y-z]|z-[z-z]|A-[A-Z]|B-[B-Z]|C-[C-Z]|D-[D-Z]|E-[E-Z]|F-[F-Z]|G-[G-Z]|H-[H-Z]|I-[I-Z]|J-[J-Z]|K-[K-Z]|L-[L-Z]|M-[M-Z]|N-[N-Z]|O-[O-Z]|P-[P-Z]|Q-[Q-Z]|R-[R-Z]|S-[S-Z]|T-[T-Z]|U-[U-Z]|V-[V-Z]|W-[W-Z]|X-[X-Z]|Y-[Y-Z]|Z-[Z-Z]|[^\\\\\\]\\[\\^\\-&]|&(?!&)|\\\\[\\\\\\^\\$\\.\\|\\?\\*\\+\\(\\)\\[\\]\\{\\}\\/\\-tnrdws])+\\])(?:(?:[\\*\\+\\?]|\\{[0-9]\\}|\\{[0-9],\\}|\\{(?:0,[0-9]|1,[1-9]|2,[2-9]|3,[3-9]|4,[4-9]|5,[5-9]|6,[6-9]|7,[7-9]|8,[8-9]|9,[9-9])\\})\\??)?)|\\((?:\\?:)?(?:(?:\\^|\\$|\\\\[bB]|(?:[^\\\\\\^\\$\\.\\|\\?\\*\\+\\(\\)\\[\\]\\{\\}]|\\\\[\\\\\\^\\$\\.\\|\\?\\*\\+\\(\\)\\[\\]\\{\\}\\/tnrdDwWsS]|\\.|\\[\\^?(?!:)(?:0-[0-9]|1-[1-9]|2-[2-9]|3-[3-9]|4-[4-9]|5-[5-9]|6-[6-9]|7-[7-9]|8-[8-9]|9-[9-9]|a-[a-z]|b-[b-z]|c-[c-z]|d-[d-z]|e-[e-z]|f-[f-z]|g-[g-z]|h-[h-z]|i-[i-z]|j-[j-z]|k-[k-z]|l-[l-z]|m-[m-z]|n-[n-z]|o-[o-z]|p-[p-z]|q-[q-z]|r-[r-z]|s-[s-z]|t-[t-z]|u-[u-z]|v-[v-z]|w-[w-z]|x-[x-z]|y-[y-z]|z-[z-z]|A-[A-Z]|B-[B-Z]|C-[C-Z]|D-[D-Z]|E-[E-Z]|F-[F-Z]|G-[G-Z]|H-[H-Z]|I-[I-Z]|J-[J-Z]|K-[K-Z]|L-[L-Z]|M-[M-Z]|N-[N-Z]|O-[O-Z]|P-[P-Z]|Q-[Q-Z]|R-[R-Z]|S-[S-Z]|T-[T-Z]|U-[U-Z]|V-[V-Z]|W-[W-Z]|X-[X-Z]|Y-[Y-Z]|Z-[Z-Z]|[^\\\\\\]\\[\\^\\-&]|&(?!&)|\\\\[\\\\\\^\\$\\.\\|\\?\\*\\+\\(\\)\\[\\]\\{\\}\\/\\-tnrdws])+\\])(?:(?:[\\*\\+\\?]|\\{[0-9]\\}|\\{[0-9],\\}|\\{(?:0,[0-9]|1,[1-9]|2,[2-9]|3,[3-9]|4,[4-9]|5,[5-9]|6,[6-9]|7,[7-9]|8,[8-9]|9,[9-9])\\})\\??)?)|\\|)*\\)(?:(?:[\\*\\+\\?]|\\{[0-9]\\}|\\{[0-9],\\}|\\{(?:0,[0-9]|1,[1-9]|2,[2-9]|3,[3-9]|4,[4-9]|5,[5-9]|6,[6-9]|7,[7-9]|8,[8-9]|9,[9-9])\\})\\??)?|\\|)*$"
        },
        "mode": {
          "description": "include keeps items the pattern finds; exclude drops them. Default include.",
          "enum": [
            "include",
            "exclude"
          ]
        },
        "caseSensitive": {
          "description": "Whether the pattern matches ASCII letters case-sensitively. Default false.",
          "type": "boolean"
        },
        "searchScope": {
          "description": "What the pattern is searched in; both searches title and description separately. Default title.",
          "enum": [
            "title",
            "both",
            "description"
          ]
        },
        "minDurationSeconds": {
          "description": "Drop videos shorter than this many seconds; 0 keeps every length. Default 0.",
          "type": "integer",
          "minimum": 0
        },
        "liveFilter": {
          "description": "Which broadcast kinds to keep: all (everything but upcoming), vod (live streams and their replays), normal (plain uploads). Default all.",
          "enum": [
            "all",
            "vod",
            "normal"
          ]
        },
        "shortsFilter": {
          "description": "Which videos to keep: all, normal (no Shorts) or shorts (only Shorts). Default all.",
          "enum": [
            "all",
            "normal",
            "shorts"
          ]
        },
        "contentMode": {
          "description": "Whether the channel contributes its uploads or its playlists. Default videos.",
          "enum": [
            "videos",
            "playlists"
          ]
        },
        "topics": {
          "description": "YouTube video category ids (strings, e.g. \"10\" for Music; the table is in shared/fixtures/feed-chips.json). With any listed, only the channel's videos in a listed category are kept; empty or absent keeps every category. Default [].",
          "type": "array",
          "items": {
            "type": "string",
            "minLength": 1
          },
          "uniqueItems": true
        },
        "groups": {
          "description": "Names of the groups the channel is in (shared/fixtures/groups.json). A group is its name: it exists while a listed channel's filter names it, and two names are one group only when identical. A name has no white space at either end and 1 to 24 code points. Empty or absent means the channel is in no group. Default [].",
          "type": "array",
          "items": {
            "type": "string",
            "minLength": 1,
            "maxLength": 24,
            "pattern": "^[^\\u0009-\\u000d\\u0020\\u0085\\u00a0\\u1680\\u2000-\\u200a\\u2028\\u2029\\u202f\\u205f\\u3000](?:[\\s\\S]*[^\\u0009-\\u000d\\u0020\\u0085\\u00a0\\u1680\\u2000-\\u200a\\u2028\\u2029\\u202f\\u205f\\u3000])?$"
          },
          "uniqueItems": true
        },
        "channelId": false,
        "title": false,
        "thumbnail": false
      }
    }
  }
}
